date	source	theme	idea	verdict	reason	overlap
2026-07-11	hunt	World Models - Architecture	Long-horizon manipulation-planning failure is dominated by compounding forward-rollout drift. A backward-reachability world model, conditioned on a goal to predict predecessor states and actions, could bypass forward drift and make long-horizon planning substantially more stable at equal compute.	accept-w-rev	The mechanism—using a backward generative predecessor world model to bypass forward drift in long-horizon manipulation planning—is covered by Time Reversal (1810.01128, manipulation)+Backward Learning (2312.05044, generative goal-conditioned predecessors). The difference is only packaging around a modern long-horizon benchmark+quantitative decay slope. The mechanism-transfer SA exception fails because the target domain already has hits→novelty is capped. Moreover, backward rollout accumulates its own reverse error, so the claim that it “fundamentally avoids forward-prediction error accumulation” is only partly true and the advantage is not guaranteed.	medium
2026-07-11	hunt	Safety and Robustness	One untested cause of early saturation in noise-space RL steering for a frozen VLA is reward hacking of a VLM-judge in latent noise space: the policy finds noise that makes the judge report success without completing the task. An oracle-reward control separates the explanations, and judge ensembles or force-signature cross-checks provide repair arms.	accept-w-rev	The mechanism—policy exploitation of VLM-judge false positives, with reward rising while true success does not—is highly homologous to Dark Side (2409.15922), giving overlap=medium→novelty is capped. The oracle control is a decisive kill experiment and the estimand, divergence between judge false-positive rate and held-out true success, is aligned, so the result is AwR. The load-bearing-removal SA route fails because ① overlap≠low and ② only 1 crack item matches (InfoRM matches/LRM is partial); no SA.	medium
2026-07-11	hunt	Cross-Domain Transfer	Cross-embodiment transfer failures concentrate near kinematic singularities and joint-limit regions unique to the target embodiment, which the source never encountered; generic embodiment distance does not predict them. Failure is predicted by the fraction of a trajectory traversing target singular neighborhoods, and singularity-aware retargeting repairs it without more data.	accept-w-rev	Each leg of the singularity/joint-limit predictor has strong precedent: FeasibleCap/RichMap predictors, the CEI distance view, and singularity-aware IK repair. With overlap=medium, only integrated naming+controlled diagnostic remain open→novelty is capped, and the mechanism-transfer SA exception fails because the target domain has nonzero hits. The controlled regression is decisive and the no-new-data repair arm is executable→AwR.	medium
2026-07-11	hunt	Human-Robot Interaction and Deployment	After human takeover, control is returned from a recovered configuration left by the operator, but that configuration lies outside the policy’s demonstration distribution. Proposition: post-handoff failure exceeds cold-start failure, with the gap predicted by distance to the demonstration manifold—an intervention can help locally yet harm at handoff.	accept-w-rev	RaC (2509.07953) already covers the handoff-state mixture-distribution phenomenon+a rewind-before-handoff repair. The idea adds only measurement+naming+estimand formalization, with weak independence and overlap=medium→novelty is capped. An experiment isolating excess handoff failure without label noise is decisive and executable→barely AwR, the weakest of the three.	medium
2026-07-11	hunt	World Models - Architecture	The load-bearing cause of long-horizon drift in a learned world model is not the character of one-step error, but autoregression itself. Replacing rollout with joint denoising of an entire trajectory should change error growth from compounding with horizon to nearly flat at matched capacity and compute.	accept-w-rev	This has a load-bearing-assumption form and a cheap, decisive falsification experiment; the unverified wager is not counted as a MAJOR. However, the headline has overlap=medium, and joint-denoise WM alternatives to AR are already widely implemented by Diffuser/DWM/Diffusion Forcing. The matched-capacity attribution is not a clear-accept-level difference, and break-glass condition ①, zero headline hits, fails→novelty is capped; no SA.	medium
2026-07-11	hunt	Action Representation	Diffusion and flow-matching action heads have an intrachunk mode-incoherence failure independent of interchunk seams: during denoising, a single chunk switches from one multimodal mode to another. Mode-anchored sampling should repair it better than seam smoothing.	accept-w-rev	The seam-separated diagnostic+mode-anchored sampling admits a decisive falsification experiment, but PF-DAG (2602.21684) substantially occupies both the mechanism and repair. The only surviving novelty is the thin diagnostic distinction from seams→overlap=medium and novelty is capped; no SA.	medium
2026-07-11	hunt	Data Engines	Teleoperation data are collected in sessions, and operator warm-up and fatigue make demonstration quality vary systematically with within-session time. Reweighting by session position should improve performance more than adding the same amount of unweighted demo data.	accept-w-rev	Within-session time as a quality axis+index reweighting vs adding the same amount of raw demo data define a decisive falsification experiment with a shuffle control. However, the causal account is occupied from both DQAF and human-factors directions, and it depends on session boundaries that DROID does not explicitly confirm and must be clustered from collector ID+timestamp→overlap=medium and novelty is capped; no SA.	medium
2026-07-11	hunt	Efficiency and Systems	VLA inference-efficiency leaderboards measure action-chunk length rather than deployment responsiveness. Rankings reverse when methods are reevaluated at equal reaction frequency; single-step latency and throughput are mismeasures confounded by chunking.	accept-w-rev	No single paper directly covers the measurement headline (overlap=medium), but the repair arm—a responsiveness-normalized metric+adaptive chunk scheduling—is densely occupied by AAC/DVAC/VLA-Corrector. The difference is insufficient for clear-accept, so novelty is capped at borderline.	medium
2026-07-11	hunt	Evaluation and Diagnostics	Success rates on contact-intensive manipulation benchmarks are dominated by failure variance in the grasp-and-approach phase, so they measure grasp reliability rather than contact skill. Resetting directly into the contact state isolates the latter and reorders policy rankings.	accept-w-rev	GraspCorrect already establishes the core empirical fact in one paper: pre-contact grasping dominates SR+an oracle start from a successful grasp isolates the remainder. Novelty is therefore heavily eroded, while “share of variance across policies”≠“what the benchmark measures,” leaving an estimand-alignment concern. Cap at AwR.	medium
2026-07-11	hunt	World Models - Training Objectives	FVD and pixel metrics for world models measure passive-dynamics fidelity, while control value exists only in the action-controllable variance subspace. The controllable-variance fraction is an overlooked confounder: as it shrinks, FVD and downstream return become increasingly decoupled.	accept-w-rev	Half of the headline—the decoupling of FVD/pixel metrics from control—is already covered by VP²/WorldArena/2606.07687. Only the estimand “controllable-variance fraction as a reportable moderator of the decoupling” is new. With overlap=medium and an insufficient clear-accept-level difference, cap at borderline.	medium
2026-07-11	hunt	VLA - Architecture	Proposition: mobile-manipulation policies trained with base and arm as one synchronous action space fail where slow base settling injects a moving reference into precise arm tracking, rather than because the task is difficult. Base–arm bandwidth conflict predicts failure better than task difficulty, and gating arm refinement on base stability provides a targeted repair.	reject	The core causal account—base motion disrupting precise arm tracking as the main failure source—is acknowledged by the target, Mobile ALOHA, and independently named or formalized by EMMa/ABot. The gated repair≈the known Stop-and-Grasp method (overlap=high). Only the estimand “bandwidth conflict as a failure predictor independent of difficulty” remains unformalized, which is insufficient to support the difference.	high
2026-07-11	hunt	Cross-Domain Transfer	Proposition: the advantage of perceptive over blind legged locomotion is usually attributed to terrain preview, but vision may primarily re-anchor state estimation by correcting proprioceptive drift caused by slip and deformation. Ablations that shorten the preview horizon and give blind locomotion oracle drift-free proprioception separate the mechanisms. The predicted advantage comes from re-anchoring on slippery or soft terrain and from preview only on geometrically complex terrain.	accept-w-rev	overlap=low, and the reverse attribution between preview and re-anchoring+the terrain-family×ablation-arm separation is supported by a strong search (6 papers read, no uncertain identifiers). However, the form is purely diagnostic; the two arms are discriminating ablations rather than repair arms whose implementation itself improves performance. No dimension reaches 8+, and there is no strong prior for a surprising finding, so cap at borderline.	low
2026-07-11	hunt	VLA - Training Paradigms	Proposition: a VLA interprets spatial language such as “behind X” or “left of X” in an egocentric camera frame by default, and failures arise from reference-frame mismatch rather than weak grounding. The success gap between egocentrically consistent and allocentric instructions separates the explanations; a reference-frame conditioning token should repair allocentric failures better than more language data.	accept-w-rev	The core causal account—mismatch between the default egocentric frame and the required allocentric/object-centric frame, rather than weak grounding—and the reference-frame conditioning repair are already published across several VLM-QA papers (2602.05789/2410.17385/2602.15892, overlap medium-high). Migration to VLA+an in-policy frame token+frame-angle regression remains, but the difference is insufficient for clear-accept. The mechanism-transfer SA exception fails because the target domain has nonzero hits in SpatialVLA/OC-VLA and the adaptation is fairly direct; cap at borderline.	medium
2026-07-11	hunt	Action Representation	The assumption that the action flow head of a frozen VLA must cold-start from data-independent Gaussian noise is not load-bearing. Warm-starting the ODE from the end of the previous action chunk can remove chunk-seam discontinuity, making cold start rather than model error or chunk stitching the root cause.	reject	Direct hit: WarmPrior (2605.13959) already delivers the full headline: remove the Gaussian cold start+use a historical-action warm source to repair seams+reduce steps. ActionCache/Legato cover two additional corners. With overlap=high, exception route ① fails because there is not zero headline occupancy.	high
2026-07-11	hunt	Efficiency and Systems	Real-time latency for edge-deployed VLA systems is dominated by memory bandwidth from long-context KV and repeated action-head forward passes rather than policy FLOPs; fewer denoising steps, early exit, and longer chunks optimize secondary terms.	reject	The direct hit, “direct-hit:2603.02271,” already performs the edge roofline decomposition on Jetson Orin/Thor, attributes ~75% to memory-bound execution, and finds that a 5× compute increase delivers only a 1.4× speedup. VLA-Perf/EfficientVLA provide further support. With overlap=high, the headline is occupied.	high
2026-07-11	hunt	Data Engines	Language instructions in robot datasets are often inferred retrospectively by annotators watching trajectories and systematically differ from the executor’s actual intent. This retrospective-labeling noise contributes to instruction-following failure.	accept-w-rev	There is no direct hit at overlap=medium, and “mismatch rate between inferred annotations and execution intent” is genuinely unoccupied as a named, measured label-noise source. However, the proposition-style diagnostic is ceiling-limited+the difference is below clear-accept+the estimand is confounded because high-mismatch segments may simply be harder; random filtering does not separate difficulty→cap at AwR.	medium
2026-07-11	hunt	VLA - Architecture	Remove the load-bearing assumption that every VLA action step must condition on visual appearance features. Feed motion and geometry instead, using optical flow+depth, and test whether appearance is load-bearing outside the few steps requiring semantic recognition.	accept-w-rev	The idea has a load-bearing-assumption form, but break-glass does not apply: overlap=medium with nonzero hits, and the two crack-evidence items are one “partial” and one “mismatch” caused by a same-name miscitation. The ordinary-form minimal falsification experiment is cheap and decisive, with no direct-hit, so the result is AwR rather than reject. VO-DP already shows through task-level ablations that appearance and geometry are both load-bearing; novelty is capped and no SA is given.	medium
2026-07-11	hunt	Evaluation and Diagnostics	Proposition: policies with equal success rates differ systematically in the minimum recoverability margin along successful trajectories. Current leaderboards measure only the endpoint and reward lucky traversal near irreversible boundaries. The minimum trajectory margin predicts failure under perturbation better than success rate and supports policy selection.	accept-w-rev	A changed evaluation target+margin-based selection repair escapes the diagnostic ceiling; the estimand matches the headline, and the experiment is decisive and executable on one GPU. However, the core estimand “continuous margin to failure→robustness prediction” already appears in Energy Margin/HJ reachability (overlap=medium). The mechanism-transfer exception fails because the target domain has nonzero hits, so novelty is capped at borderline.	medium
2026-07-11	hunt	VLA - Architecture	Proposition: VLA failures on quantities and quantifiers are not visual counting errors, but missing “remaining items to manipulate” progress state in the action head. A remaining-count token should repair performance better than full visual grounding of all targets.	accept-w-rev	The named problem+a remaining-count head provide a repair arm, with overlap=low, clean dual oracle arms separating perception from action, and a decisive single-GPU experiment. It is the strongest of the three. However, the nearest neighbor 2602.24143 gives the opposite attribution—failure on the grounding side—and requires direct confrontation, while the benchmark is narrow, using synthetic LIBERO with N≤4 targets. Only Higher reaches 8 while remaining below the “high-probability clear-accept + oral-presentation” SA ceiling.	low
2026-07-11	hunt	Efficiency and Systems	Action chunking is not load-bearing for policy quality; it is load-bearing only for inference-latency compensation. With zero-latency asynchronous execution, chunk=1+ history conditioning should match the optimal chunk across all tasks, including non-Markovian ones.	accept-w-rev	This removes a load-bearing assumption and has a cheap, decisive minimal falsification experiment under a real forcing constraint. However, the “quality vs latency” causal-account framework is already formalized by 2507.09061, with the opposite conclusion+a markovian lower bound. Novelty is capped; no SA.	medium
2026-07-11	hunt	World Models - Architecture	Stepwise autoregressive rollout is not load-bearing for a world model; compounding error is its structural cost rather than an essential property. A horizon-conditioned direct skip predictor can avoid accumulation between steps.	reject	overlap=high: the causal account in which direct skip or horizon-conditioned predictors structurally remove compounding error is collectively occupied by TDM/γ-models/ADM/Jumpy World Models (2602.19634), covering both mechanism and naming. This is a direct-hit.	high
2026-07-11	hunt	VLA - Training Paradigms	Language conditioning is not load-bearing for deployment-level manipulation generalization in a VLA; it serves only as a task-id. Replace language with goal-image conditioning, preserve compositional generalization, and conclude that efforts to “restore language grounding” target the wrong object.	accept-w-rev	This removes a load-bearing assumption and offers a decisive replacement arm+placebo test; eliminating VLM compute is a real forcing constraint. However, the goal-vs-language space is heavily occupied and several papers provide contrary evidence that language is necessary for unseen generalization. With overlap=medium, novelty is capped; no SA.	medium
2026-07-12	weekly	World Models - Architecture	The main cause of long-horizon world-model rollout drift is decaying action conditioning—the model progressively ignores actions—rather than compounded pixel error. The decay curve should predict downstream planning failure better than prediction error.	reject	The headline, “drift is driven by collapse of action conditioning+repairable,” is occupied by Delta-JEPA (2606.31232)+Persistent-WM (2603.25685). Only the diagnostic increment of using decay as a stepwise failure predictor remains; the lowest verdict across three reviews is reject.	medium
2026-07-12	weekly	Action Representation	A discrete action tokenizer outperforms a continuous head because quantization removes subthreshold action noise, not because of a sequence-modeling prior. Giving the continuous head a matched quantization noise floor should close the gap.	accept-w-rev	The competing account+noise-floor discrimination experiment is relatively new, but ActionCodec (2602.15397) occupies adjacent tokenizer resistance to overfitting and 2412.16326 is an isomorphic precedent in vision, capping novelty at medium. One estimand-alignment issue adds a MAJOR.	medium
2026-07-12	weekly	Data Engines	Define decision-relevant action bandwidth: frequency content in teleoperation actions in the >10 Hz band is interpolation or hand-tremor noise that models fit and evaluations reward. Training and evaluation should be filtered by frequency band.	reject	FreqPolicy (2506.01583) directly occupies and exploits low-frequency action compressibility. The estimand that evaluation rewards high-frequency noise is weak and the increment is thin; the lowest verdict across three reviews is reject.	medium
2026-07-12	weekly	VLA - Architecture	Remove the load-bearing assumption that a VLA must re-encode vision from raw pixels at every control step. Vision is load-bearing only at sparse perceptual decision points; a learned trigger determines when to re-encode, while other steps reuse features+proprioception.	reject	Prescreen direct occupancy: AC2-VLA (2601.19634)/VLA-Cache/DySL-VLA (2602.22896) already cover adaptive or cached visual computation and redundancy in an always-on backbone. All five axiom-removal fields are present, but the headline is occupied.	high
2026-07-12	weekly	Safety and Robustness	OOD failure in manipulation policies is predicted earlier and more accurately by novelty in proprioceptive or action space than by visual OOD detection; replace the visual gate with a proprioceptive-space conformal gate.	reject	Prescreen direct occupancy: ActProbe (2606.08508) claims that action signals predict failure before it becomes visible, so one paper covers the headline.	high
2026-07-12	weekly	Evaluation and Diagnostics	Define intrinsic policy reliability=the success variance induced by action sampling from a fixed initial state. It predicts deployment degradation better than mean success rate, and low-variance decoding improves worst-case performance.	reject	Fixed-state variance is already formalized by PhAIL (2605.29710)/Rethink-Repeatable (2505.08216). The idea is ceiling-limited as a pure diagnostic, and it was excluded by the deep-review quota.	medium
2026-07-12	weekly	VLA - Training Paradigms	The real function of web vision-language co-training for a VLA is not preserving semantic knowledge, but preventing the visual encoder from collapsing onto a narrow robot distribution. Encoder-rank regularization can replace it cheaply using robot-only data.	reject	Prescreen direct occupancy: Preserving-Pretrained-Representations (2509.11417, frozen or partially frozen encoders prevent collapse)+the established role of mainstream co-training in preventing overfitting already cover the claim, and inexpensive replacements also exist.	high
2026-07-15	hunt	Cross-Domain Transfer	Negative transfer in a multitask VLA is caused not by shared-representation capacity conflict, but by opposing contact-force gradients at visually neighboring states.	accept-w-rev	A local repair is valuable and falsifiable, but the current controls cannot separate opposing contact-force gradients from generally difficult states, and the full experiment matrix has not been shown feasible on 1×H100 within 5 days.	medium	ceiling-limited
2026-07-15	hunt	VLA - Training Paradigms	The manipulation gain from high-resolution tactile sensing comes not from spatial texture content, but from a phase clock supplied by contact transitions.	accept-w-rev	Replacing tactile imaging with an event clock is sufficiently distinct to warrant testing, but the strongest-baseline set omits recent phase-aware methods, while the training scale is ambiguous and doubtful under a budget of 1×H100 for 3 days.	medium	ceiling-limited
2026-07-15	hunt	Data Engines	The emergence breakpoint for compositional skills is caused not by parameter scale crossing a threshold, but by the training-data skill-transfer graph crossing a connectivity threshold.	reject	The priorwork review found high overlap with direct work showing that a connectivity phase transition in the training-data support graph determines and moves the capability-emergence breakpoint. A robot skill graph and λ2 are only target-domain instantiations and cannot support clear-accept-level novelty.	high	novelty-dead
2026-07-15	hunt	VLA - Architecture	VLA failures on objects with repeated appearance arise mainly from identity rebinding after occlusion rather than single-frame spatial grounding. Having the action head reference persistent cross-time object identities instead of current-frame detection slots should improve only identity-swap conditions.	reject	Prescreen direct occupancy: https://arxiv.org/abs/2605.06481	high	novelty-dead
2026-07-15	hunt	World Models - Architecture	The fixed-budget bottleneck in an object-centric world model is not token count, but continued computation in regions where physical constraints have already closed. Distill a routing policy from an oracle based on physical-residual propagation, then spend the saved compute on a longer horizon to improve planning over strong learned-router baselines.	accept-w-rev	A longer horizon under a fixed budget has clear efficiency and planning value, and the minimal falsification experiment is executable. However, target-domain dynamic world-model routing has a direct neighbor, and object-level routing by physical residual is not yet a clear-accept-level difference.	medium	ceiling-limited
2026-07-15	hunt	World Models - Training Objectives	Long-horizon world-model planning fails not because one-step prediction error is large, but because latent state incorrectly merges histories with identical futures under the behavior policy that diverge under changed actions. Explicitly penalizing counterfactual branch collapse should improve planning more than further reducing reconstruction error.	reject	UWM-JEPA, causal-state/PSR, and Counterfactual Regularization collectively occupy the headline estimand and training mechanism. The remaining history-pairing metric and loss cannot clear the F1 novelty CRITICAL.	high	novelty-dead
2026-07-15	hunt	Efficiency and Systems	Long-tail latency in an edge VLA is not exogenous noise; it can form a closed-loop thermal instability through “high-frequency corrective actions→chip heating→frequency throttling→staler observations→more corrections.” Jointly scheduling computation depth and action cadence by thermal headroom should be more stable than allocating compute by sample difficulty.	accept-w-rev	The thermal–latency–correction loop has clear deployment value and an executable experiment, but the gap in industrial-occupancy search and insufficient causal identification in the current experiment each add one MAJOR, capping the result at accept-w-rev.	medium	ceiling-limited
2026-07-15	hunt	Action Representation	Failure across control frequencies is caused not by temporal aliasing, but by action tokens treating “amount per step” as a physical invariant. Representing duration-aware integrated displacement or impulse should preserve the same physical effect at unseen frequencies.	reject	Prescreen direct occupancy: https://arxiv.org/abs/2606.24049	high	novelty-dead
2026-07-15	hunt	Data Engines	Filtering demonstrations by success rate and action smoothness systematically removes high-curvature but successful recovery segments. Cleaner data therefore have less recovery-state coverage; retaining samples by their ability to return to the task manifold after a deviation should improve perturbed recovery.	reject	Prescreen direct occupancy: https://arxiv.org/abs/2606.15587	high	novelty-dead
