date	source	theme	idea	verdict	reason	overlap
2026-07-06	hunt	Cross-Domain Transfer	One demonstration for a redundant arm corresponds to an entire equivalent action manifold in joint null space; analytically sample Jacobian null-space motion for task-preserving augmentation and add a null-space-invariance loss, improving data efficiency and transfer across heterogeneous kinematic embodiments.	accept-w-rev	Null-space augmentation is a mechanism transfer, and "task-preserving augmentation" is crowded, with verified RoCoDA occupation yielding one MAJOR; uncertain identifier self-check yields a second MAJOR→novelty is capped. The minimal falsification experiment (Franka simulation±augmentation±invariance loss, jitter-arm control, transfer signal +10pt, runnable on one GPU) is executable, so it remains accept-w-rev.	low
2026-07-06	hunt	Safety and Robustness	When vision-implied state contradicts force/proprioception-implied state (vision reports contact while force denies it=penetration/localization error), the cross-modal disagreement itself is an unlabeled perception-fault detector for deployment-time early stopping and online auditing of VLM-judge rewards.	accept-w-rev	Use vision↔force/proprioception learned cross-modal likelihood disagreement as an unlabeled detector. The minimal falsification experiment (pathology injection set, AUROC vs FIPER/Sentinel/residual FDI + removal of the cross-modal component) is executable and falsifiable; however, the diagnostic neighbor 2602.12032 creates gray-area overlap, and the difference cannot reach clear-accept, so novelty remains capped below SA.	low
2026-07-06	hunt	Efficiency and Systems	Visual forward passes are the most expensive step in edge VLA deployment, while force/proprioception are cheap and high-rate; formulate "compute-optimal sensor scheduling," using surprise in cheap modalities to decide whether to skip the visual backbone and treating vision as an expensive sensor sampled on demand.	accept-w-rev	No single paper occupies the problem framing "use cheap-modality surprise to skip visual forward passes under compute-optimal per-sample sensor cost." The falsification experiment requires a Pareto signal of ≥40–50% fewer visual passes+force/phase-aligned trigger times and is executable and falsifiable; ElegantVLA (2605.29438) reuses motion cues for visual compute and is a substantive competitor, capping novelty below SA.	medium
2026-07-06	hunt	VLA - Training Paradigms	Part of a teleoperator's action is driven by force felt at the hand, yet that force channel is usually neither recorded nor given to the policy, causing BC to attribute force-driven decisions to vision. Formalize this as unobserved confounding in the imitation target and quantify its systematic contact-phase bias.	reject	The minimal falsification signal, "contact-phase-selective gains," cannot distinguish the headline attribution "human-felt force=an unobserved BC confound" from published force-aware VLA (ForceVLA/FACTR) gains that already concentrate in contact (F6, the decisive experiment does not test the headline, MAJOR). Novelty also lies only in explanation/combination, while BRIDGE (phase selectivity)/force-conditioned/Causal-IL occupy the neighborhood; this is not a new method (F1, fragment-dominated, MAJOR).	medium
2026-07-06	hunt	World Models - Architecture	Construct a learned world model as a contact-implicit variational integrator that learns a discrete Lagrangian instead of directly predicting the next state, using structure preservation (momentum/symplectic structure) to eliminate long-horizon rollout drift.	reject	Prescreen direct hit: https://arxiv.org/abs/2605.08279	high
2026-07-06	hunt	Action Representation	Replace continuous action trajectories with self-supervised discrete contact-mode sequences; the VLA first plans mode transitions, then a low-level controller fills in continuous motion within each mode.	accept-w-rev	The self-supervised two-level contact-mode representation has an executable falsification experiment and a handcrafted phase baseline, but DHAL/HDP/latent-action strongly occupy the three components, and the strongest counterexample DHAL was not opened. Novelty is capped below SA.	medium
2026-07-06	hunt	Evaluation and Diagnostics	Test whether physical-conservation residuals in a world model predict downstream model-based policy failures better than pixel/latent prediction errors, making physical fidelity a better WM selection signal.	accept-w-rev	Conservation residuals vs prediction error as a WM selection signal is a clean, inexpensive, falsifiable diagnostic headline, but only 2 papers were fully read, the diagnostic ceiling is uncertain, and unverified novelty is capped.	low
2026-07-06	hunt	VLA - Training Paradigms	Use world-model coverage as a reward-free intrinsic signal to pretrain a noise-space steering policy for a frozen VLA, testing whether it reduces sample cost on later rewarded tasks.	accept-w-rev	Reward-free frozen-VLA noise-space coverage pretraining has DSRL neighbors and a falsifiable design, but InDRiVE is nearly isomorphic (reward-free+WM-disagreement pretraining), and the heavy stack requires multiple GPUs, capping it at AwR.	medium
2026-07-06	hunt	VLA - Architecture	"Compile" a language instruction once: a hypernetwork generates small policy weights from the instruction, then removes the language tower entirely at deployment; test whether weight-level conditioning improves compositional generalization over parameter-matched FiLM distillation.	reject	Prescreen direct hit: https://arxiv.org/abs/2510.04898	high
2026-07-06	hunt	Evaluation and Diagnostics	Treat the physics engine as an unreported evaluation degree of freedom: reevaluate the same policies in two faithfully cross-ported simulation benchmarks, quantify ranking sensitivity to engine choice, and separate dynamics from rendering effects.	accept-w-rev	2606.10366 directly quantifies the headline "does ranking change with the engine" as a confound across three platforms. Under adverse judgment, the controlled-attribution difference may be insufficient for clear-accept, while the noise floor does not cover porting-artifact confounds; novelty is capped with 2 MAJOR findings.	medium
2026-07-06	hunt	Data Engines	Measure a "demonstration replay ceiling" for every embodied benchmark: replay demonstrations under the benchmark's own success criterion, use the resulting success upper bound to correct SOTA saturation claims, and test whether replay failure predicts per-task BC degradation.	accept-w-rev	The strongest counterexample, OpenVLA replay-filtering artifacts, was not opened; Semantic Scholar was rate-limited, and the search admits blind spots→weak prior-work review is MAJOR and novelty remains unverified. The predictive-validity claim also fails to control task difficulty as a common cause, adding another MAJOR. Both headline implications are unoccupied, and the experiment is inexpensive and falsifiable, leaving it borderline.	low
2026-07-06	hunt	Action Representation	Evaluate action representations without training policies: build a training-free intrinsic suite for action tokenizers (round-trip reconstruction spectrum/closed-loop replay fidelity/perturbation amplification) and test whether intrinsic scores predict downstream VLA rankings.	accept-w-rev	ActionCodec, the nearest neighbor, was not read even though its full text determines whether overlap increases, so adverse judgment yields one MAJOR. With n=12 representation points, the study also lacks power for the requirement that the bootstrap CI not overlap the single-metric MSE baseline, adding another MAJOR. The training-free suite+predictive-validity test itself is unoccupied across 8 fully read papers.	medium
2026-07-06	hunt	World Models - Training Objectives	Remove observation reconstruction as a default world-model objective; use value-equivalence/self-prediction objectives and test whether a robot world model without pixel reconstruction matches downstream control success from current reconstruction-based video-pretrained world models under equal data and compute.	accept-w-rev	The headline wager (reconstruction is unnecessary/harmful) is partly supported by 2606.07687 (CALVIN)+MuDreamer (nearly isomorphic) +2406.17718, with overlap=medium, so break-glass condition ① (zero hits) fails and SA is capped. The residual "equal-compute downstream-control head-to-head+causal ablation of the reconstruction auxiliary head" has no single-paper coverage, and the minimal falsification experiment is decisive→borderline.	medium
2026-07-06	hunt	VLA - Training Paradigms	Use similarity between force/tactile signatures and demonstrated contact prototypes to construct unlabeled dense rewards, replacing or supplementing VLM-judge so RL steering of a frozen VLA gets contact-phase rewards immune to visual interpenetration artifacts.	accept-w-rev	The distance-to-demonstration reward scaffold is mature in OTR, and force is a modality swap; the three mechanism-transfer conditions, including nontrivial adaptation and a signal sufficient for clear-accept, fail, capping SA. The force-signature+frozen-VLA-steering+interpenetration-motivation combination has no single-paper coverage, and falsification includes a decisive constant-amplitude attribution arm→borderline.	low
2026-07-06	hunt	Efficiency and Systems	Use a VLA's forward model to predict the expected proprioception/force stream as an efference copy, re-encoding expensive vision only when measured-predicted deviation crosses a threshold, so sensor surprise triggers compute allocation.	accept-w-rev	The adaptive-compute VLA umbrella is crowded (AC²-VLA/VLA-Cache/ElegantVLA/…), leaving only "gating on efference prediction error." Among 8 reads, only 2 were opened directly and 4 secondary competitors matched only by abstract, making prior-work review weak under a crowded umbrella→2 MAJOR findings cap it. A rate-matched random attribution arm makes the kill test decisive→borderline.	low
2026-07-06	hunt	Cross-Domain Transfer	When multiple embodiments demonstrate the same task, use phase-wise cross-embodiment trajectory variance to separate task-invariant subgoals from embodiment-specific execution; automatically extract an embodiment-agnostic subgoal skeleton as a training target for transfer to unseen embodiments.	accept-w-rev	The headline (phase-wise cross-embodiment trajectory variance for segmentation→explicit skeleton supervision) has no single-paper coverage, but the broader proposition "separate task-invariant vs embodiment-specific execution" is occupied by XIRL/VLBiMan/BiDemoSyn, and priorwork judges the difference from XIRL insufficient for clear-accept→novelty is capped. The minimal falsification experiment has text-subgoal+joint-training attribution arms and is executable on 1×H100; it is not a direct hit, so this is not reject.	medium
2026-07-06	hunt	Evaluation and Diagnostics	In mixed-source co-training, policies may identify data provenance implicitly and exploit source-specific shortcuts; formalize source leakage as hidden confounding and use a source-decoding probe with source-removal intervention to quantify damage to real transfer.	reject	The headline (data source=a hidden confound exploitable by the policy that systematically harms real transfer) is broadly asserted by 2508.06426 through its diversity/fragmentation framing (overlap medium-high). The I2 margin is only a diagnostic toolkit of a standard source-decoding probe+gradient-reversal source removal+placebo arm, not an independent contribution; the evidence→verdict path therefore leaves the F1 case dominated by close work.	medium
2026-07-06	hunt	Data Engines	Remove the load-bearing assumption that manipulation-video pretraining must depict hands or grippers acting on objects; test whether pure physical-event video without an actuator provides equally transferable dynamics priors under equal tokens.	accept-w-rev	The load-bearing-assumption form fails both break-glass tests (overlap=low-medium rather than low; only GR-2 supports the crack, while self-reported 2605.27817 was verified "not supporting")→return to the ordinary form. "Wager unverified" is one MAJOR, and partial support for "why removal is now possible" is another; however, no single paper covers the headline equal-token three-arm comparison, and the minimal falsification experiment is cheap, decisive, and runnable on 1×H100→capped at accept-w-rev.	low
2026-07-06	hunt	World Models - Architecture	Use only compositional algebraic consistency of actions in latent space (associativity+returning to the start after do/undo) as the world model's sole self-supervised learning signal, without reconstruction or reward.	accept-w-rev	The headline (composition+cycle latent-action algebra) is systematically anticipated by 2605.24578 at medium-high overlap. Only "algebra as the sole signal replacing reconstruction+manipulation domain+downstream control" remains uncovered, and the falsification experiment is decisive→capped at AwR.	medium
2026-07-06	hunt	VLA - Architecture	Desktop manipulation is approximately equivariant to scene SE(2); apply known transformations at deployment, measure whether actions transform accordingly, and use equivariance violations as a reward-free self-supervised signal for online test-time adaptation.	accept-w-rev	Equivariance consistency as an online TTA loss is established by TransAdapt in vision, leaving I2 as domain transfer to VLA. Mechanism-transfer SA condition ② fails because the mechanism adaptation is nontrivial, but zero target-domain hits+a placebo falsification experiment→AwR.	low
2026-07-06	hunt	VLA - Training Paradigms	Remove the objective requiring action heads to regress recorded demonstration actions; instead use a frozen world model's effect-matching self-supervision, accepting any action predicted to achieve the demonstrated next-step geometric effect and making BC set-valued.	accept-w-rev	"Effect>recorded action" is strongly anticipated by GLAM/State-Alignment at medium-high overlap. Assumption-removal SA condition ① fails because overlap is not low, and condition ② fails because only 1 crack supports the claim; the decisive falsification experiment→ordinary-form AwR ceiling.	medium
2026-07-06	hunt	World Models - Training Objectives	Have the world model predict the object's final resting equilibrium in quasi-static manipulation rather than frame-by-frame transients, making outcome state rather than process the planning timescale.	accept-w-rev	The minimal falsification experiment is decisive and runnable by one researcher on 1×H100, but overlap=medium: 2411.04374 plans on equilibrium-state manifolds and 2509.21664 predicts stable placement states. Priorwork judges the headline difference insufficient for clear-accept, capping novelty below SA.	medium
2026-07-06	hunt	Efficiency and Systems	Allocate policy reasoning depth by proximity to irreversibility: reason deeply and act slowly near release, pouring, or interference insertion; reason shallowly and act quickly in free space.	accept-w-rev	overlap=low with a decisive random/difficulty-gating attribution arm, but difficulty-gating work such as GeCO already covers irreversible phases incidentally, leaving the increment entirely dependent on unverified causal separation. SA condition ③, that a realized signal suffices for clear-accept, fails, so the idea remains capped.	low
2026-07-06	hunt	Cross-Domain Transfer	A large share of cross-embodiment transfer failure may come from timescale mismatch rather than kinematics: the source embodiment can produce action bandwidth that the target cannot follow mechanically.	accept-w-rev	The bandwidth-ratio+low-pass-repair framework is uncovered in the search (overlap=low) and has an executable falsification experiment, but only 4 papers were fully read and the strongest neighbor, RichMap, was not read in full. Weak prior-work review is MAJOR, novelty remains incompletely verified, and the idea is capped.	low
2026-07-06	hunt	Evaluation and Diagnostics	Treat total energy (inference joules+trajectory-motion joules) as a primary embodied-evaluation measure; test whether success-rate rankings reorder under a fixed energy budget and whether energy-optimal policies systematically sacrifice long-tail recovery.	accept-w-rev	The main ranking-reorder contribution is measurement-heavy under the broad "evaluate policies by energy" framework established by The Price Is Not Right (2602.19260). The newer energy-recovery tension arm is downgraded to a weak attribution observation, and simulated energy proxies weaken the edge-deployment motivation, leaving insufficient SA ceiling. The minimal falsification experiment remains executable, with overlap=low and feasibility for one researcher on 1×H100, reaching accept-w-rev.	low
2026-07-06	hunt	Safety and Robustness	Propose compute-adaptive safety margins: when shared or edge compute is cut, the policy automatically widens spatial margins and slows down, trading speed for safety under compute starvation instead of collapsing under passive degradation.	accept-w-rev	overlap=low with a strong decisive c-vs-b falsification design, but the learned mechanism in decisive arm c is underspecified. Feasible filtering/clipping risks reducing to the existing combination "CBF/HJ safety filtering+anytime slowing," and removing denoising steps may not validly simulate compute starvation. Oral/spotlight confidence is insufficient, so adverse judgment caps it at accept-w-rev.	low
2026-07-06	hunt	Action Representation	Bottleneck localization: for tiny edge policies failing high-precision tasks, the binding constraint may be action parameterization rather than parameter count; choosing the right action space could close more of the large-model gap than adding parameters.	accept-w-rev	Priorwork has overlap=medium and explicitly judges the difference "insufficiently certain" for clear-accept; the premise that "action space matters" is strongly established by 2602.23408→the hard novelty-cap rule excludes SA. A parameterization×size interaction remains unoccupied, and the probe is executable and falsifiable (the wager dies if the interaction is insignificant), reaching accept-w-rev.	medium
2026-07-06	hunt	Data Engines	Action-aligned narration in internet instructional/manipulation video contains physical information invisible to vision, including force, fragility, temperature, and compliance; use narration as free weak labels for force/contact/fragility in manipulation-video pretraining to restore contact-phase physical priors.	accept-w-rev	Narration→weak force/fragility/compliance labels has an executable minimal falsification experiment with a decisive "semantic arm vs physical arm" attribution. However, DeliGrasp/Feature Fields occupy the premise that language carries physical information, and the difference is not clear-accept-level→novelty is capped below SA.	low
2026-07-06	hunt	Action Representation	Spontaneous speed profiles in first-person human video are maps of precision/caution demand (slow=fragile high-precision contact, fast=free space). Current human-to-robot transfer keeps spatial paths but discards timing; predict and transfer tempo as free cross-embodiment supervision to prevent contact-phase failures.	accept-w-rev	Tempo as a cross-embodiment caution map+shuffled attribution has no single-paper coverage and a decisive experiment, but overlap=medium, the premise "slow=high precision" is firmly established in variable-impedance LfD/Fitts work, and the difference is uncertain. With no dimension reaching ≥7→novelty is capped at borderline.	medium
2026-07-06	hunt	Cross-Domain Transfer	Resampling source data with different control frequencies onto one time base during cross-embodiment co-training systematically aliases high-frequency contact transitions. Reinterpret part of negative transfer as a sampling-rate-aliasing data-pipeline artifact rather than embodiment kinematics, and separate the explanations with anti-aliasing resampling.	accept-w-rev	Attributing part of negative transfer to sampling-rate aliasing+holding kinematics fixed has overlap=low and the strongest experimental design (probe=5). However, the minimal falsification experiment is simulation-only and constructively creates aliasing, the prevalence in real OXE data is not directly falsified, and the repair is textbook→insufficient evidence for SA.	low
2026-07-06	hunt	Human-Robot Interaction and Deployment	Formalize one supervisor serving N robots as an intervention queue: each robot uses expected wait time to decide when to request help and how to behave while waiting (safe hover/continue slowly/proceed at risk), then test whether queue awareness expands supervised fleet size by an order of magnitude under equal staffing.	accept-w-rev	Robot-side queue-aware help requests occupy a low-overlap gap and have an executable, falsifiable experiment, but priorwork admits the difference from the Fleet-DAgger dual is "insufficient (uncertain)" for clear-accept, capping novelty. The task-state cost behind the headline difference "hovering is not free" is also not instantiated in LIBERO/RoboCasa (1 MAJOR).	low
2026-07-06	hunt	Human-Robot Interaction and Deployment	Instruction wording for a frozen VLA is an unused free policy parameter: perform black-box wording search with a few deployment rollouts and quantify how much success pure language-side adaptation recovers with zero training and zero weight access.	reject	The headline mechanism (test-time black-box wording search as a deployment adaptation channel for a frozen VLA) is directly covered by 2606.12299 (rollout-feedback wording search+black-box frozen VLA+LIBERO+real robot) and 2602.12281 (verifier-selected rewrites). Priorwork judges overlap=high and falsifies the "why it may be new" premise; F1 is dominated by close work and therefore CRITICAL.	high
2026-07-06	hunt	World Models - Architecture	Increase manipulation-world-model observation context by an order of magnitude, use the "persistence half-life" of contained/occluded objects as a primary estimand, and compare the persistence-compute frontier of longer attention windows against compressed fixed-size state.	accept-w-rev	No single paper covers the headline combination (container-hidden-state half-life estimand+same-compute four-architecture×context frontier), but all three components are separately occupied and three close 2026 papers are converging quickly. Priorwork admits the difference from On Memory is "insufficient (uncertain)," capping novelty, and the "same compute" matching protocol is undefined (1 MAJOR).	medium
2026-07-07	hunt	Safety and Robustness	Treat embodied reward/VLM-judge metrics as the evaluated object: build a simulated perception-pathology diagnostic set with known truth—interpenetration false completions, occluded true completions, and threshold flicker—and measure each reward signal's false positives, false negatives, and temporal stability rather than policy quality.	accept-w-rev	Recheck raises overlap to medium: RoboReward (2601.00675) +2606.01036 occupy most of the headline. The residual (sim pathology taxonomy+temporal stability) lacks independent evidence for clear accept, capping novelty; validity of a simulation-artifact certificate when extrapolated to real-robot evaluation adds one MAJOR.	medium
2026-07-07	hunt	Human-Robot Interaction and Deployment	Human-in-the-loop deployment evaluation treats intervention rate/autonomous duration as objective, but the person pressing the intervention key is an uncalibrated measuring instrument. Quantify how much inter-supervisor variance explains cross-method gaps and define a reproducible standardized synthetic-supervisor protocol.	accept-w-rev	overlap=low, but this is a mechanism transfer of the rater-calibration paradigm in 2602.22585 to HIL, with insufficient evidence for SA conditions ① and ③. A video proxy cannot measure online intervention variance (MAJOR), while HRI/human-factors venues were not searched, making prior-work review weak (MAJOR), so the idea is capped.	low
2026-07-07	hunt	Evaluation and Diagnostics	VLA has no validation set: checkpoints are selected by test-task success. Formalize this overlooked "winner's curse" confound as selection bias analytically predictable from evaluation noise, then quantify its share of reported gains.	accept-w-rev	The headline phenomenon was named and measured by 2606.04233 (best/final gap 0.6–4.4pp), while RouterVLA measures 1.87×; the residual is analytical/audit refinement with capped novelty. The claim about "share of reported gains" is not identifiable under the current design, adding one MAJOR.	medium
2026-07-07	hunt	Cross-Domain Transfer	Negative transfer in cross-embodiment co-training may concentrate in contact phases with the largest embodiment-dynamics differences rather than uniformly; decompose negative transfer by manipulation phase and predict its location from phase-level dynamics divergence.	accept-w-rev	overlap=low, but the headline mechanism (divergence predicts transfer) is occupied by 2003.13150, while the increment only moves to phase granularity and its expected direction is qualitative consensus in the adjacent sim2real domain (2311.07499). Priorwork judges the difference insufficient for clear-accept, capping novelty; the minimal falsification experiment is executable and falsifiable, so this remains borderline rather than reject.	low
