date	source	theme	idea	verdict	reason	overlap
2026-07-05	hunt	World Models - Architecture	Replace vision as the primary world-model observation with contact-microphone audio+proprioception, and test whether "audible dynamics" suffice for latent-dynamics prediction in contact-rich manipulation.	accept-w-rev	Audio world models (2512.08405) and world-model modality ablations (2606.13877) jointly cover most of the methodology, capping novelty; contact-sound fidelity in data/simulation remains uncertain, but the specific framing around phase-dependent visual redundancy is unoccupied, and the falsification experiment is feasible on 1×H100	unknown
2026-07-05	hunt	Action Representation	Define actions in tactile space: the policy predicts desired contact-state changes (normal force/slip/contact location), and a low-level tactile servo closes the loop, decoupling the action representation from embodiment.	reject	CRITICAL (F1): The headline "contact/force-space action interface+low-level servo+cross-embodiment transfer" is directly occupied by 2606.15516 and FeelTheForce (2506.01944); the remaining increment only specifies the tactile-state vocabulary and cannot establish a clear-accept-level distinction within the lifecycle.	unknown
2026-07-05	hunt	Efficiency and Systems	Treat a VLA's open-loop action chunk as speculative execution, using a jointly predicted force/tactile envelope as a "physical assertion" that triggers abort, rollback, and replanning (pipeline flush) when measurements cross its bounds.	accept-w-rev	The "chunk=speculative execution+assertion+abort" framework is occupied by SV-VLA (2604.02965) and 2603.19418, capping novelty; the minimal falsification experiment also compares only a weak fixed-chunk baseline and omits strong RDP/SV-VLA-line baselines (F3). The specific combination of force assertions+kHz low-level validation was not found, and the experiment is feasible and falsifiable.	unknown
2026-07-05	hunt	Data Engines	Use audio tracks from internet human videos to label "contact moments" automatically, providing structured pseudo-supervision for manipulation pretraining and injecting contact structure into video representations.	reject	CRITICAL (F1): RepLAI (2209.13583) fully implements the headline mechanism, "audio track=free contact-moment labeler→video-representation pretraining," on the same data sources (Ego4D/EPIC); the remaining increment merely changes the downstream task to manipulation BC, transferring a known mechanism to a new domain.	unknown
2026-07-05	hunt	Evaluation and Diagnostics	Quantify, phase by phase, how much information vision/force/proprioception each provide about the optimal action; formalize a "modality switch point" and test whether vision is nearly redundant during contact.	accept-w-rev	The reported prior-work search omits the adjacent human perceptual-motor-control/cue integration literature, making it weak (MAJOR). Single-modality probe predictability≠conditional mutual information, and modality correlation confounds the switch-point definition (MAJOR). No direct robotics precedent was found for the per-timestep quantification framework, and the probe experiment is feasible and falsifiable within hours.	unknown
2026-07-05	hunt	Safety and Robustness	Detect precursors to failure from geometric statistics of the π0.5 flow-matching denoising trajectory, enabling safe early stopping before action execution.	accept-w-rev	Failure detection from intrinsic generative signals is crowded; Sentinel (2410.04640) sampling dispersion and denoising geometry may measure the same phenomenon, capping novelty. The falsification experiment directly tests the increment against final-action statistics, has a sound design, and is feasible in several days on 1×H100	unknown
2026-07-05	hunt	Evaluation and Diagnostics	Apply psychometric item response theory to embodied benchmarks: estimate each task's discrimination and difficulty, remove uninformative tasks, and construct a short adaptive evaluation.	accept-w-rev	The mechanism (difficulty-and-discrimination estimation+adaptive-subset rank reproduction) is fully developed by tinyBenchmarks/ATLAS/2603.23749 in the LLM and agent domains, while 2606.04233 explicitly identifies embodiment as future work, leaving only domain transfer (MAJOR). With 2PL IRT and only ~10 policies as ability points, discrimination parameters may be unidentifiable, and comparisons against random subsets may be drowned by noise (MAJOR).	unknown
2026-07-05	hunt	Evaluation and Diagnostics	Quantify the "noise floor" of VLA evaluation success rates by decomposing test-retest variance on the same checkpoint, then measure how many reported performance gaps fall below evaluation noise.	reject	CRITICAL (F1): The headline finding that most reported gaps lack statistical significance was already quantified by benchmark in 2606.04233 (priorwork self-rated as high overlap), so the nearest work directly dominates the idea. The remaining increment (test-retest variance decomposition+MDE lookup) has too low a ceiling for a standalone paper.	unknown
2026-07-05	hunt	Cross-Domain Transfer	Define a training-free "transferability score" for cross-embodiment robot data that predicts which heterogeneous data actually benefit a target embodiment without training a large model.	accept-w-rev	Validation uses only n=6-8 datasets; Spearman≥0.7 has little statistical power at that sample size, while a multi-component score has enough freedom to overfit 8 points (MAJOR). Using simulated Franka as the target and real-robot data as sources confounds measured gains with both the sim gap and embodiment transfer, limiting transfer back to the real target (MAJOR). Although overlap is low, shallow reads and the workshop boundary keep novelty capped.	unknown
2026-07-05	hunt	World Models - Training Objectives	Replace "predict accurately" with "judge correctly" as the world-model training objective: use policy-ranking fidelity as an explicit loss to create a world model specialized as an offline evaluator.	accept-w-rev	The ranking loss requires ground-truth environment returns from many policies as training labels, which are precisely the cost offline evaluation seeks to avoid; label acquisition is unspecified (MAJOR). The 10-20 checkpoints from different stages of the same training run are highly correlated, so ranking fidelity may not generalize to unseen policy families and the evaluator may overfit (MAJOR). WM-as-evaluator and VAML also constrain the space; the increment is only the loss form, with motivation already published in 2606.15032	unknown
2026-07-05	hunt	VLA - Training Paradigms	Inject random asynchronous delays into each modality during training and provide the delay as a conditioning token, teaching the VLA to "know how stale its sensors are" for latency robustness and degraded-hardware operation.	accept-w-rev	The delay-simulation+conditioning scaffold is occupied by TT-RTC (2605.08168) and 2512.05964; on a standard VLA testbed (only RGB+proprioception), per-modality asynchrony nearly collapses to the existing global-delay setting (MAJOR). Quasi-static simulated manipulation may be insensitive to 100-300 ms stale observations; if the baseline does not degrade, the signal floor is too low and the falsification experiment may be vacuous (MAJOR).	unknown
2026-07-05	hunt	Evaluation and Diagnostics	Repair the phase-wise modality-information framework by replacing single-modality probes with interventional masking and conditional-mutual-information estimation, producing an identifiable "modality switch point."	accept-w-rev	On expert trajectories, masked-probe CMI measures imitation information for "expert actions under the expert-state distribution," not the claimed "information about optimal actions"; the estimand and conclusion are misaligned (MAJOR). The phenomenon itself (a shift toward force during contact) was observed qualitatively in 2509.23468; the identifiable formalization is a real contribution, but its ceiling is borderline, the radar has no 8+ dimension, and it does not meet the SA threshold.	unknown
2026-07-05	hunt	VLA - Architecture	Embed a several-hundred-Hz proprioception/force "reflex pathway" beneath a slow visual VLA backbone, continuously correcting actions during chunk execution; train the reflex layer jointly with the backbone instead of relying on a handcrafted impedance fallback.	reject	CRITICAL (F1): The headline "slow VLA backbone+high-frequency force-driven small-network within-chunk residual correction" architecture is covered by FAVLA (2602.23648)/PhaForce (2603.08342)/RDP (2503.02881)/MRC (2603.15152) (priorwork rated high). The residual differences—proprioception-only input, a 100-500 Hz update range, and joint training—are configuration-level and do not overcome the prior-work dominance.	unknown
2026-07-05	hunt	Data Engines	Use only the proprioception/torque streams already recorded in large teleoperation datasets to mine collision, slip, and drop events offline, producing failure labels for existing corpora at scale and at no new collection cost.	accept-w-rev	The open combination (pure-proprioception offline retrospective failure mining for DROID/OXE-scale corpora) is valid and the falsification experiment is feasible, but both halves of the mechanism are occupied (2509.26308 establishes force/proprioception anomaly detection; SCIZOR/FIDeL cover automatic labeling of large offline corpora). This scales a known mechanism into a new domain, and torque/current availability across OXE subsets is unverified by the reported search; 2 MAJOR issues cap the result.	unknown
2026-07-05	hunt	World Models - Training Objectives	Add a sparse force/torque decoding auxiliary loss to a video world model that is active "only at contact-event moments," and test whether <1% additional supervision can disproportionately repair contact-dynamics errors in prediction.	accept-w-rev	The headline direction, "force/contact supervision in video world models," is occupied by the dense variants FAWAM/ChronoDreamer/VTAM, capping novelty. The residual "sparse event triggering +<1% supervision leverage" hypothesis is unvalidated and can be killed by the falsification experiment, but the leverage claim requires a dense-control arm and has the ceiling of a supervision-budget ablation.	unknown
2026-07-05	hunt	Efficiency and Systems	Formalize action-chunk length as a trade-off between "replanning-latency benefit vs open-loop drift cost under environmental stochasticity," derive how the optimum scales with measurable environment statistics, and test it with probe experiments.	accept-w-rev	Robot learning lacks a quantitative theory of optimal chunk length, but intermittent-control theory in human motor control (Gawthrop 2011) quantifies the same trade-off. The formalization is a cross-domain transfer, capping novelty; the falsification experiment is feasible and the signal is falsifiable, with a ceiling around a solid poster rather than an oral.	unknown
2026-07-05	hunt	World Models - Architecture	Build a retrieval-augmented world model that queries similar transitions from the deployment environment's recent interaction buffer before prediction, using them as context for gradient-free adaptation to new object dynamics.	accept-w-rev	Dynamics-as-Prompts (2410.20357) already provides "interaction context→gradient-free dynamics adaptation" with real-robot validation; retrieval and the adaptation target are engineering-level variants (MAJOR). The minimal falsification experiment compares only against an ordinary world model and omits a recent-history-context baseline, so any gain cannot be attributed to the novel retrieval component (MAJOR); 2 MAJOR issues cap the result.	unknown
2026-07-05	hunt	Cross-Domain Transfer	Refine cross-embodiment data transferability scores from dataset level to episode level, then test whether they predict data utility at thousand-sample scale with leave-one-embodiment-out validation on real corpora.	accept-w-rev	Episode-level data valuation is crowded (DemInf/CUPID), and Re-Mix already covers OXE utility weighting. The remaining combination of a "cross-embodiment transferability target+leave-one-embodiment-out protocol" is novel only at the combination level (MAJOR). Within real corpora, "target-embodiment performance" can only use an offline proxy weakly correlated with actual performance, so selection effects may be lost in noise (MAJOR); 2 MAJOR issues cap the result.	unknown
2026-07-05	hunt	VLA - Training Paradigms	Use time-reversal symmetry as free physical supervision for manipulation data: reverse quasi-static segments that remain physically feasible, train the VLA with reversal augmentation, and use reversal-consistency residuals to label irreversible events automatically.	reject	The core mechanism is occupied in parts—PvP produces "reverse-task demonstrations+pick↔place swapping" (BC/real robot), while TR-DRL provides "reversal augmentation+dynamics-consistency reversibility filtering." The residual combination, "transfer to the VLA domain+AUROC output form," collides at F1 and is CRITICAL. TSDA also shows that reversal augmentation degrades substantially in realistic settings that violate reversibility, adding 1 MAJOR issue	unknown
2026-07-05	hunt	Safety and Robustness	Attach a self-supervised geometric-consistency auxiliary head (cross-view relative pose/temporal reprojection) to a frozen VLA visual encoder, using deployment-time spikes in auxiliary error to monitor perception health and stop early.	accept-w-rev	The mechanism precedent (SSL loss as an OOD score, NeurIPS'19)+the observation-side FIPER baseline each undermine the motivation that existing detectors are mostly action-side (MAJOR). A geometric-consistency auxiliary head dedicated to perceptual fidelity had zero hits across the VLA search surface (14 papers read); the minimal falsification experiment is feasible and falsifiable, with 2 MAJOR issues capping the result	unknown
2026-07-05	hunt	Efficiency and Systems	Transfer "video coding for machines" to robot corpora: allocate lossy-compression bitrate by policy relevance and test whether fleet-scale storage can fall by an order of magnitude without reducing policy performance.	accept-w-rev	The VCM×policy training combination has zero arXiv hits, but LeRobot reports that "standard encoding compresses to ~14% without reducing policy performance," leaving uncertain headroom for policy-aware bitrate allocation (MAJOR). Only 3 papers were read, and the industrial fleet search is weak (MAJOR). The falsification experiment is cheap and genuinely falsifiable; 2 MAJOR issues cap the result	unknown
2026-07-05	hunt	World Models - Architecture	Refine retrieval world models around cross-episode lifelong memory, and compare directly against a strong recent-history-context baseline so gains can be attributed to retrieval itself.	accept-w-rev	EMWM (NeurIPS'22 wksp) occupies the core mechanism of "cross-episode nonparametric transition memory assisting world-model prediction"; the difference is motivation and setting rather than mechanism (MAJOR). The interleaved task stream is tailored to retrieval without evidence from real deployment streams, suggesting F9 (MAJOR). The attribution design and recent-history-context baseline are sound; 2 MAJOR issues cap the result	unknown
2026-07-05	hunt	Action Representation	Probe whether Euclidean flow-matching action heads fail in rotation-heavy manipulation because they ignore SO(3) manifold structure, using a geodesic action head as the controlled comparison.	reject	LDA (2606.01847) already occupies the headline as a method paper: it names the VLA action head's "Euclidean Fallacy" and shows gains from a manifold-correct version on CALVIN+real robots. The probe's bottleneck question has therefore been answered; the residual off-manifold quantification+failure-correlation attribution cannot sustain a paper (F1 CRITICAL), while an A-tier probe would require a surprising finding (1 MAJOR)	unknown
2026-07-05	hunt	Safety and Robustness	Test whether compression (quantization/pruning) disproportionately erases a VLA's long-tail recovery and safety behavior, causing perturbed recovery to collapse before nominal success rates move.	accept-w-rev	The mechanism is isomorphic to 1911.05248 (compression harms the long tail), making the headline a transfer of a known phenomenon into a closed-loop domain. A simulation-side perturbation-recovery protocol has no established precedent and must be created, leaving its validity open to challenge; 2 MAJOR issues cap the result	unknown
2026-07-05	hunt	Cross-Domain Transfer	Test whether the optimal policy model shrinks under domain shift: smaller models may become more robust as shift grows, yielding a "shift-size" selection law for edge deployment.	reject	The premise has direct counterevidence in the nearest domain (2112.04094 finds larger models better on worst-group performance). A reversal trained from scratch across a 1M-100M family would be attributed to textbook bias-variance rather than a new finding, and the experiment cannot support the claimed deployment-level "shift-size selection law" (F6). Adding a pretrained VLA-scale model family exceeds a defensible single-researcher 1×H100 budget; >2 directional defects remain	unknown
2026-07-05	hunt	VLA - Architecture	Move capacity from parameters into state: use tiny weights+a large writable recurrent state so a VLA improves through accumulated state without gradient updates during deployment, targeting edge-memory budgets.	accept-w-rev	Memory-VLA work is dense, but only 3 papers were read and several named neighbors (MAP-VLA/EchoVLA/ReMem-VLA) were not, leaving novelty unverified. The minimal falsification experiment also lacks KV-cache/long-context ICL baselines needed to distinguish the core claim from existing in-context adaptation; 2 MAJOR issues cap the result	unknown
2026-07-05	hunt	Action Representation	Measure the "action information rate" (bits/s) a task truly requires, testing whether action decoding can be nearly parameter-free and a tiny VLA should allocate almost all capacity to perception.	accept-w-rev	The conditional entropy rate of demonstrations upper-bounds behavioral diversity rather than the "task-required information rate," so the headline and measurement are misaligned. The reported search also omits the direct Fitts' law/human-motor-control information-rate lineage, leaving novelty unverified; 2 MAJOR issues cap the result	unknown
2026-07-05	hunt	World Models - Training Objectives	Train a world model on paired rollouts coupled with common random numbers to predict "the outcome difference between two actions" directly, making action evaluation cheaper and more accurate than absolute-future prediction.	accept-w-rev	A trainable Δ-model applies where simulation seeds are controllable, precisely where direct CRN evaluation makes it least necessary; approximate coupling in the real world is only narrative. The search read only 3 papers and did not cover the OR literature where CRN originated, so it falls below SA-grade prior-work standards; 2 MAJOR issues cap the result	unknown
2026-07-05	hunt	Efficiency and Systems	Time-share one VLA server across multiple robots, using remaining action-chunk duration as scheduling slack to propose and test a new "fleet-brain scheduling" problem.	reject	CRITICAL F1: Kairos (2605.11381) already covers "multiple robots sharing an inference server+execution-aware scheduling," while ROSA (2607.01088) covers fleet-level metrics. The headline claim of a new problem is false, and the remaining gap is only one scheduling signal whose prior use remains unverified	unknown
2026-07-05	hunt	Evaluation and Diagnostics	Replace binary success rate as the embodied-evaluation estimand with a censored time-to-completion survival function, gaining severalfold statistical power under the same rollout budget.	reject	Prescreen direct hit: https://arxiv.org/abs/2605.29710	high
2026-07-05	hunt	Data Engines	Hold the training recipe and evaluation fixed, make the data-collection pipeline itself the evaluated object, and establish a DataComp-style data benchmark protocol for robot manipulation.	accept-w-rev	The empirical core is split between MimicLabs+2503.07017, and prior-work review records the remaining protocol-level difference as "insufficient," capping novelty. The falsification signal requires a second RoboCasa grid, while the budget lists only 12 LIBERO runs, so the stated experiment cannot falsify itself.	medium
2026-07-05	hunt	Data Engines	Systematically measure train-evaluation contamination in VLA evaluation: quantify overlap between pretraining corpora and benchmark tasks, then measure how much overlap inflates leaderboard scores.	accept-w-rev	LIBERO-PRO already occupies the qualitative headline, reducing surprise and capping novelty. Overlap strata are confounded by task difficulty/domain, and SimplerEnv lacks ≥10 tasks per stratum, making the proposed stratified arm infeasible.	medium
2026-07-05	hunt	Evaluation and Diagnostics	Create a known-order policy ladder through calibrated degradation, unit-test the validity of embodied-benchmark metrics and tasks, and produce an "evaluation validity certificate."	accept-w-rev	Mechanism precedents exist across gridworld, NLG, and OPE, while nontrivial closed-loop adaptation is unproven, capping novelty. The "known-order" foundation is unreliable: small noise may be harmless, low τ cannot distinguish a task defect from a ladder defect, and the full rollout matrix underestimates compute by severalfold.	low
2026-07-05	hunt	VLA - Training Paradigms	Turn "blind before sighted" into a VLA curriculum: mask vision early and learn contact structure from proprioception+force, then anneal visual dropout probability from 1 to 0; test whether modality introduction order suppresses visual shortcuts and improves robustness under distribution shift.	reject	CRITICAL (F1): The headline mechanism, "weaken vision early and anneal its intensity to zero to suppress visual shortcuts," is covered by FACTR (2502.17432) and independently confirmed by CRAFT (2602.12532). Priorwork judges overlap=high, leaving only systematic ablation and measurement, insufficient for a clear-accept-level difference; there is also 1 MAJOR (F3: the reported strongest baseline is constant modality dropout, omitting the true nearest neighbor FACTR).	high
2026-07-05	hunt	Data Engines	Measure the "substitution elasticity" between visual-only and tactile demonstrations: fit iso-performance curves over a modality-mixture grid, determine how many visual-only demonstrations equal one force/tactile demonstration, and provide a quantitative basis for fleet sensor budgets.	accept-w-rev	The formulation (iso-performance curves over modality mixtures+substitution elasticity) is unoccupied under independent prior-work review, but exchange-rate/mixture scans are mature across sim-real, human-video/teleoperation, and LLM-data-mixture axes. Near transfer across axes caps novelty (MAJOR), while the "fleet sensor budget" motivation relies on sim→real extrapolation that cannot be validated in phase-1 (F6, MAJOR). The minimal falsification experiment is executable, has a clear and conservative kill signal, and therefore remains borderline.	medium
2026-07-05	hunt	World Models - Architecture	Factor the visual-inertial-odometry pattern "fast-path integration+slow-path loop-closure correction" into a manipulation world model: proprioception/force dead-reckons latent state at millisecond frequency and exposes drift uncertainty, while vision provides low-frequency corrections on demand, reducing visual frame rate by an order of magnitude.	accept-w-rev	OmniVTA (2603.19201) occupies the main structure and efficiency claim, "high-frequency proprioception/touch+low-frequency vision with rollout that avoids visual-frame generation," capping novelty (MAJOR). The reported strongest baselines (single-rate WM+dropout/Clockwork-VAE/KVAE) omit an OmniVTA-style fixed-schedule slow-fast WM (F3, MAJOR). The residual "drift uncertainty triggers on-demand visual correction" has zero search hits and an executable falsification experiment, yielding a borderline narrowed headline.	medium
2026-07-05	hunt	Action Representation	Use a path-speed-decoupled action representation: BC learns geometric paths from canonical-speed demonstrations reparameterized by arc length, while an independent speed controller sets speed online at deployment, making execution speed an in-distribution control.	reject	Prescreen direct hit: https://arxiv.org/abs/2606.00110	high
2026-07-05	hunt	Efficiency and Systems	Propose a closed-loop "latency-capacity" scaling law: on fixed edge hardware, larger models consume staler observations; predict and measure an optimal model-size crossover in dynamic manipulation whose position moves predictably with environment speed.	accept-w-rev	Novelty is capped. Reference: 2412.14355 identifies the size→latency→stochastic-environment-cost chain in games, and that paper plus RTC's asynchronous-execution result directly violate the idea's survival condition. The residual quantitative crossover in manipulation is insufficient for clear accept, with MAJOR=2 capping the result.	medium
